{
  "contract_id": "retention-recommendation",
  "contract_version": "1.0.0",
  "recommendation_id": "0b4c7d2e9f1a35b8",
  "status": "proposed",
  "document_ref": {
    "artifact_id": "a1b2c3d4-e5f6-4a7b-8c9d-0e1f2a3b4c5d",
    "uri": "file:///G:/数据/04-审计数据集与基准/PCCA-Benchmark/benchmark_cases/bigcase/BCSA/BCSA_big_01/fault_tickets.json",
    "sha256": "a1b2c3d4e5f67890a1b2c3d4e5f67890a1b2c3d4e5f67890a1b2c3d4e5f67890",
    "media_type": "application/json"
  },
  "recommendation": "retain",
  "rationale": {
    "matched_rules": ["ref_count_above_threshold"],
    "last_access_days": 30,
    "ref_count": 3,
    "classification": "internal",
    "detail": "文档被 3 个活动对象引用，且最近访问在 30 天前以内，建议保留。"
  },
  "summary": {
    "retain": 1,
    "archive": 0,
    "delete_candidate": 0
  },
  "signature": {
    "recommended_by": "knowledge.retention-recommendation@0.1.0",
    "reviewed": false
  },
  "constraints": {
    "no_delete": true,
    "evidence_immutable": true,
    "requires_human_approval": true
  },
  "provenance": {
    "source_sha256": "a1b2c3d4e5f67890a1b2c3d4e5f67890a1b2c3d4e5f67890a1b2c3d4e5f67890",
    "plugin": "knowledge.retention-recommendation@0.1.0",
    "recommend_time": "2026-09-06T12:00:00Z"
  }
}